{
  "id": "governancecharter",
  "version": "0.1",
  "title": "AI Governance Charter",
  "aiContext": "Dit is een AI Governance Charter: een beknopt (idealiter één pagina) mandaat- en richtinggevend document voor alle AI-activiteiten binnen de organisatie. Gebaseerd op de AI Body of Knowledge (Template 1, AI Governance Charter). Het legt scope, leidende principes, governance-organen, rollen, besluitvorming, escalatie en reviewcyclus vast. Schrijf bondig en sturend; houd het charter kort — een charter dat niemand leest, is waardeloos.",
  "meta": {
    "homeComponent": "HomePage",
    "exportLabel": "AI Governance Charter",
    "docTitle": "AI Governance Charter",
    "footerLabel": "AI Governance Charter",
    "filename": "AI-Governance-Charter.pdf",
    "systemNamePlaceholder": "Bijv. AI Governance Charter Ministerie X",
    "homeContent": {
      "notice": "Houd het charter bewust beknopt — bij voorkeur maximaal één pagina. Bespreek het met de directie, juridische zaken en IT-management. Focus op de vijf of zes principes die de organisatie echt sturen.",
      "description": "Het AI Governance Charter legt op hoofdlijnen vast wie beslist over wat, welke principes gelden en hoe escalatie werkt. Het vormt het mandaat en de richtlijn voor alle AI-activiteiten binnen de organisatie. Gebaseerd op de AI Body of Knowledge (Template 1).",
      "steps": [
        "Doel en scope: waar geldt het charter voor",
        "Principes: vijf tot zes leidende principes voor AI-inzet",
        "Organen en rollen: governance-organen en verantwoordelijkheden",
        "Besturing: besluitvorming, escalatie en reviewcyclus"
      ],
      "buttonLabel": "Starten met het charter"
    }
  },
  "features": {
    "riskClassification": false,
    "decisionGate": false,
    "conditionalPartB": false
  },
  "navigation": [
    { "type": "subsections", "sectionId": "gc_a" },
    { "type": "subsections", "sectionId": "gc_b" },
    { "type": "subsections", "sectionId": "gc_c" },
    { "type": "subsections", "sectionId": "gc_d" },
    { "type": "specialView", "viewId": "summary", "label": "Naar samenvatting" }
  ],
  "sections": [
    {
      "id": "gc_a",
      "title": "Doel en scope",
      "part": "A",
      "subsections": [
        {
          "id": "gc_a1",
          "title": "1. Doel en scope",
          "description": "Beschrijf het doel van het charter en de reikwijdte ervan.",
          "questions": [
            {
              "id": "gc_a.doel",
              "text": "Doel van dit governance charter",
              "guidance": "Beschrijf in 2–3 zinnen het doel van dit charter.",
              "type": "text",
              "importance": "mandatory"
            },
            {
              "id": "gc_a.organisatieonderdelen",
              "text": "Organisatieonderdelen binnen de scope",
              "type": "text",
              "importance": "mandatory",
              "format": "shorttext"
            },
            {
              "id": "gc_a.typen_ai",
              "text": "Typen AI-systemen binnen de scope",
              "type": "text",
              "importance": "mandatory",
              "format": "shorttext"
            },
            {
              "id": "gc_a.uitgesloten",
              "text": "Uitgesloten (buiten scope)",
              "type": "text",
              "importance": "optional",
              "format": "shorttext"
            },
            {
              "id": "gc_a.ingangsdatum",
              "text": "Ingangsdatum",
              "type": "text",
              "importance": "mandatory",
              "format": "date"
            }
          ]
        }
      ]
    },
    {
      "id": "gc_b",
      "title": "Principes",
      "part": "B",
      "subsections": [
        {
          "id": "gc_b1",
          "title": "2. Leidende principes",
          "description": "Formuleer de vijf tot zes principes die AI-inzet in de organisatie sturen.",
          "questions": [
            {
              "id": "gc_b.principes",
              "text": "Leidende principes voor AI-inzet",
              "guidance": "Formuleer per principe een korte titel en een toelichting. Houd het bij vijf of zes principes die echt sturen.",
              "type": "table",
              "importance": "mandatory",
              "columns": [
                { "id": "nr", "label": "Nr." },
                { "id": "principe", "label": "Principe" },
                { "id": "toelichting", "label": "Toelichting" }
              ],
              "notesLabel": "Aanvullende toelichting bij de principes",
              "minRows": 5,
              "maxRows": 8
            }
          ]
        }
      ]
    },
    {
      "id": "gc_c",
      "title": "Governance-organen en rollen",
      "part": "C",
      "subsections": [
        {
          "id": "gc_c1",
          "title": "3. Governance-organen",
          "description": "Beschrijf de organen die AI-governance dragen, hun samenstelling, frequentie en mandaat.",
          "questions": [
            {
              "id": "gc_c.organen",
              "text": "Governance-organen",
              "type": "table",
              "importance": "mandatory",
              "columns": [
                { "id": "orgaan", "label": "Orgaan", "hint": "Bijv. AI-stuurgroep, AI-ethiekcommissie, AI Center of Excellence" },
                { "id": "samenstelling", "label": "Samenstelling" },
                { "id": "frequentie", "label": "Frequentie" },
                { "id": "mandaat", "label": "Mandaat" }
              ],
              "notesLabel": "Toelichting bij de governance-organen",
              "minRows": 1,
              "maxRows": 10
            }
          ]
        },
        {
          "id": "gc_c2",
          "title": "4. Rollen en verantwoordelijkheden",
          "description": "Beschrijf de sleutelrollen en wie deze vervult.",
          "questions": [
            {
              "id": "gc_c.rollen",
              "text": "Rollen en verantwoordelijkheden",
              "guidance": "Bijv. AI-sponsor (eindverantwoordelijk voor AI-strategie), AI-eigenaar (per systeem, prestaties en compliance), AI-architect (technische architectuur en standaarden), AI-ethiekfunctionaris (toetsing aan ethische kaders), data-eigenaar (kwaliteit en beschikbaarheid trainingsdata).",
              "type": "table",
              "importance": "mandatory",
              "columns": [
                { "id": "rol", "label": "Rol" },
                { "id": "verantwoordelijkheid", "label": "Verantwoordelijkheid" },
                { "id": "naam", "label": "Naam / functie" }
              ],
              "notesLabel": "Toelichting bij de rollen",
              "minRows": 1,
              "maxRows": 12
            }
          ]
        }
      ]
    },
    {
      "id": "gc_d",
      "title": "Besluitvorming, escalatie en review",
      "part": "D",
      "subsections": [
        {
          "id": "gc_d1",
          "title": "5. Besluitvormingsproces",
          "description": "Leg vast wie beslist over welk type AI-besluit, met welk advies en binnen welke doorlooptijd.",
          "questions": [
            {
              "id": "gc_d.besluitvorming",
              "text": "Besluitvormingsproces",
              "type": "table",
              "importance": "mandatory",
              "columns": [
                { "id": "besluittype", "label": "Type besluit", "hint": "Bijv. nieuw hoog-risico systeem, nieuw laag-risico systeem, wijziging, uitfasering" },
                { "id": "beslisser", "label": "Beslisser" },
                { "id": "advies", "label": "Advies door" },
                { "id": "doorlooptijd", "label": "Max. doorlooptijd" }
              ],
              "notesLabel": "Toelichting bij het besluitvormingsproces",
              "minRows": 1,
              "maxRows": 10
            }
          ]
        },
        {
          "id": "gc_d2",
          "title": "6. Escalatieprocedure",
          "description": "Beschrijf de escalatieniveaus, hun trigger, naar wie wordt geëscaleerd en de maximale reactietijd.",
          "questions": [
            {
              "id": "gc_d.escalatie",
              "text": "Escalatieprocedure",
              "type": "table",
              "importance": "mandatory",
              "columns": [
                { "id": "niveau", "label": "Niveau", "hint": "Bijv. 1 – operationeel, 2 – tactisch, 3 – strategisch" },
                { "id": "trigger", "label": "Trigger" },
                { "id": "escaleren_naar", "label": "Escaleren naar" },
                { "id": "reactietijd", "label": "Max. reactietijd" }
              ],
              "notesLabel": "Toelichting bij de escalatieprocedure",
              "minRows": 1,
              "maxRows": 8
            }
          ]
        },
        {
          "id": "gc_d3",
          "title": "7. Reviewcyclus en vaststelling",
          "description": "Leg de frequentie van terugkerende governance-activiteiten vast en wie het charter vaststelt.",
          "questions": [
            {
              "id": "gc_d.reviewcyclus",
              "text": "Reviewcyclus",
              "type": "table",
              "importance": "optional",
              "columns": [
                { "id": "activiteit", "label": "Activiteit", "hint": "Bijv. charter-review, herclassificatie risico, volwassenheidsmeting, compliance-audit" },
                { "id": "frequentie", "label": "Frequentie (x per jaar)" },
                { "id": "verantwoordelijke", "label": "Verantwoordelijke" }
              ],
              "notesLabel": "Toelichting bij de reviewcyclus",
              "minRows": 1,
              "maxRows": 8
            },
            {
              "id": "gc_d.vaststelling",
              "text": "Vastgesteld door (naam + datum)",
              "type": "text",
              "importance": "mandatory",
              "format": "shorttext"
            }
          ]
        }
      ]
    }
  ]
}
